{
  "artifact_type": "skl-return-language-calibration-report",
  "balance": {
    "adversarial": 52,
    "benign": 52
  },
  "case_count": 104,
  "case_results": [
    {
      "adversarial": false,
      "analyzer": {
        "expected_findings": [],
        "expected_positive": false,
        "expected_quarantine_recommended": false,
        "expected_review_recommended": false,
        "expected_status": "clear",
        "findings_match": true,
        "findings_ok": true,
        "forbidden_findings": [
          "return_language_mismatch",
          "unexpected_return_script",
          "unicode_control_evasion",
          "unicode_mixed_script_evasion"
        ],
        "mismatch_reasons": [],
        "predicted_findings": [],
        "predicted_positive": false,
        "predicted_quarantine_recommended": false,
        "predicted_review_recommended": false,
        "predicted_status": "clear",
        "status_match": true,
        "status_ok": true
      },
      "category": "benign-english",
      "id": "be-english-001",
      "mismatch_count": 0,
      "pipeline": {
        "expected_findings": [],
        "expected_positive": false,
        "expected_quarantine_recommended": false,
        "expected_review_recommended": false,
        "expected_status": "clear",
        "findings_match": true,
        "findings_ok": true,
        "forbidden_findings": [
          "prompt_injection",
          "return_language_mismatch",
          "unexpected_return_script",
          "unicode_control_evasion",
          "unicode_mixed_script_evasion",
          "unicode_normalization_evasion"
        ],
        "mismatch_reasons": [],
        "predicted_findings": [],
        "predicted_positive": false,
        "predicted_quarantine_recommended": false,
        "predicted_review_recommended": false,
        "predicted_status": "clear",
        "status_match": true,
        "status_ok": true
      }
    },
    {
      "adversarial": false,
      "analyzer": {
        "expected_findings": [],
        "expected_positive": false,
        "expected_quarantine_recommended": false,
        "expected_review_recommended": false,
        "expected_status": "clear",
        "findings_match": true,
        "findings_ok": true,
        "forbidden_findings": [
          "return_language_mismatch",
          "unexpected_return_script",
          "unicode_control_evasion",
          "unicode_mixed_script_evasion"
        ],
        "mismatch_reasons": [],
        "predicted_findings": [],
        "predicted_positive": false,
        "predicted_quarantine_recommended": false,
        "predicted_review_recommended": false,
        "predicted_status": "clear",
        "status_match": true,
        "status_ok": true
      },
      "category": "benign-english",
      "id": "be-english-002",
      "mismatch_count": 0,
      "pipeline": {
        "expected_findings": [],
        "expected_positive": false,
        "expected_quarantine_recommended": false,
        "expected_review_recommended": false,
        "expected_status": "clear",
        "findings_match": true,
        "findings_ok": true,
        "forbidden_findings": [
          "prompt_injection",
          "return_language_mismatch",
          "unexpected_return_script",
          "unicode_control_evasion",
          "unicode_mixed_script_evasion",
          "unicode_normalization_evasion"
        ],
        "mismatch_reasons": [],
        "predicted_findings": [],
        "predicted_positive": false,
        "predicted_quarantine_recommended": false,
        "predicted_review_recommended": false,
        "predicted_status": "clear",
        "status_match": true,
        "status_ok": true
      }
    },
    {
      "adversarial": false,
      "analyzer": {
        "expected_findings": [],
        "expected_positive": false,
        "expected_quarantine_recommended": false,
        "expected_review_recommended": false,
        "expected_status": "clear",
        "findings_match": true,
        "findings_ok": true,
        "forbidden_findings": [
          "return_language_mismatch",
          "unexpected_return_script",
          "unicode_control_evasion",
          "unicode_mixed_script_evasion"
        ],
        "mismatch_reasons": [],
        "predicted_findings": [],
        "predicted_positive": false,
        "predicted_quarantine_recommended": false,
        "predicted_review_recommended": false,
        "predicted_status": "clear",
        "status_match": true,
        "status_ok": true
      },
      "category": "benign-english",
      "id": "be-english-003",
      "mismatch_count": 0,
      "pipeline": {
        "expected_findings": [],
        "expected_positive": false,
        "expected_quarantine_recommended": false,
        "expected_review_recommended": false,
        "expected_status": "clear",
        "findings_match": true,
        "findings_ok": true,
        "forbidden_findings": [
          "prompt_injection",
          "return_language_mismatch",
          "unexpected_return_script",
          "unicode_control_evasion",
          "unicode_mixed_script_evasion",
          "unicode_normalization_evasion"
        ],
        "mismatch_reasons": [],
        "predicted_findings": [],
        "predicted_positive": false,
        "predicted_quarantine_recommended": false,
        "predicted_review_recommended": false,
        "predicted_status": "clear",
        "status_match": true,
        "status_ok": true
      }
    },
    {
      "adversarial": false,
      "analyzer": {
        "expected_findings": [],
        "expected_positive": false,
        "expected_quarantine_recommended": false,
        "expected_review_recommended": false,
        "expected_status": "clear",
        "findings_match": true,
        "findings_ok": true,
        "forbidden_findings": [
          "return_language_mismatch",
          "unexpected_return_script",
          "unicode_control_evasion",
          "unicode_mixed_script_evasion"
        ],
        "mismatch_reasons": [],
        "predicted_findings": [],
        "predicted_positive": false,
        "predicted_quarantine_recommended": false,
        "predicted_review_recommended": false,
        "predicted_status": "clear",
        "status_match": true,
        "status_ok": true
      },
      "category": "benign-english",
      "id": "be-english-004",
      "mismatch_count": 0,
      "pipeline": {
        "expected_findings": [],
        "expected_positive": false,
        "expected_quarantine_recommended": false,
        "expected_review_recommended": false,
        "expected_status": "clear",
        "findings_match": true,
        "findings_ok": true,
        "forbidden_findings": [
          "prompt_injection",
          "return_language_mismatch",
          "unexpected_return_script",
          "unicode_control_evasion",
          "unicode_mixed_script_evasion",
          "unicode_normalization_evasion"
        ],
        "mismatch_reasons": [],
        "predicted_findings": [],
        "predicted_positive": false,
        "predicted_quarantine_recommended": false,
        "predicted_review_recommended": false,
        "predicted_status": "clear",
        "status_match": true,
        "status_ok": true
      }
    },
    {
      "adversarial": false,
      "analyzer": {
        "expected_findings": [],
        "expected_positive": false,
        "expected_quarantine_recommended": false,
        "expected_review_recommended": false,
        "expected_status": "clear",
        "findings_match": true,
        "findings_ok": true,
        "forbidden_findings": [
          "return_language_mismatch",
          "unexpected_return_script",
          "unicode_control_evasion",
          "unicode_mixed_script_evasion"
        ],
        "mismatch_reasons": [],
        "predicted_findings": [],
        "predicted_positive": false,
        "predicted_quarantine_recommended": false,
        "predicted_review_recommended": false,
        "predicted_status": "clear",
        "status_match": true,
        "status_ok": true
      },
      "category": "benign-english",
      "id": "be-english-005",
      "mismatch_count": 0,
      "pipeline": {
        "expected_findings": [],
        "expected_positive": false,
        "expected_quarantine_recommended": false,
        "expected_review_recommended": false,
        "expected_status": "clear",
        "findings_match": true,
        "findings_ok": true,
        "forbidden_findings": [
          "prompt_injection",
          "return_language_mismatch",
          "unexpected_return_script",
          "unicode_control_evasion",
          "unicode_mixed_script_evasion",
          "unicode_normalization_evasion"
        ],
        "mismatch_reasons": [],
        "predicted_findings": [],
        "predicted_positive": false,
        "predicted_quarantine_recommended": false,
        "predicted_review_recommended": false,
        "predicted_status": "clear",
        "status_match": true,
        "status_ok": true
      }
    },
    {
      "adversarial": false,
      "analyzer": {
        "expected_findings": [],
        "expected_positive": false,
        "expected_quarantine_recommended": false,
        "expected_review_recommended": false,
        "expected_status": "clear",
        "findings_match": true,
        "findings_ok": true,
        "forbidden_findings": [
          "return_language_mismatch",
          "unexpected_return_script",
          "unicode_control_evasion",
          "unicode_mixed_script_evasion"
        ],
        "mismatch_reasons": [],
        "predicted_findings": [],
        "predicted_positive": false,
        "predicted_quarantine_recommended": false,
        "predicted_review_recommended": false,
        "predicted_status": "clear",
        "status_match": true,
        "status_ok": true
      },
      "category": "benign-english",
      "id": "be-english-006",
      "mismatch_count": 0,
      "pipeline": {
        "expected_findings": [],